{
 "name": "acc",
 "design_point": "out/design/vsum_tree_w8/design_point.json",
 "tag": "snax_forge",
 "inputs": ["acc.a"],
 "outputs": ["acc.out"],
 "groups": [
  {
   "name": "acc",
   "csrs": [
    {"name": "START", "access": "rw", "offset": 0, "width": 32},
    {"name": "JOBS", "access": "rw", "offset": 1, "width": 32},
    {"name": "STATUS", "access": "ro", "offset": 3},
    {"name": "COUNTER", "access": "ro", "offset": 4}
   ],
   "units": [
    {
     "name": "acc",
     "brm": "accumulate",
     "datapath": "TreeAccumulate",
     "ports": {
      "a": {"port": "in", "dtype": "int64", "lanes": 8},
      "out": {"port": "out", "dtype": "int64", "lanes": 1}
     },
     "params": {"op": "add"},
     "timing": {"latency": 1, "ii": 1},
     "csrs": [{"name": "JOB_BEATS", "access": "rw", "offset": 2, "width": 32}]
    }
   ],
   "links": []
  }
 ]
}
